<?xml version="1.0" encoding="utf-8" ?>
<!DOCTYPE CoffeeHouses SYSTEM "CoffeeHouse.dtd">
<CoffeeHouses>
    <CoffeeHouse>
        <Administrator>Sam</Administrator>
        <Waitress>Kira</Waitress>
        <Barista>Din</Barista>
        <Menus>
            <Menu>
                <Description>Menu</Description>
                <Latte>Latte</Latte>
                <Americano>Americano</Americano>
                <Cappuccino>Cappuccino</Cappuccino>
                <Espresso>Espresso</Espresso>
            </Menu>
        </Menus>
    </CoffeeHouse>
</CoffeeHouses>